[
  {
    "id": "consultants_module_01_role_modern_hair_restoration",
    "programId": "program_certificate_consultation_patient_coordination",
    "levelId": "level_consultants_foundation_certificate",
    "sectionId": "section_consultants_level_1_foundation",
    "slug": "role-of-the-consultant-nurse-in-modern-hair-restoration",
    "title": "The Role of the Consultant and Nurse in Modern Hair Restoration",
    "shortTitle": "Role in Modern Hair Restoration",
    "sequence": 1,
    "status": "draft",
    "estimatedStudyMinutes": 100,
    "moduleOverview": "Teaching Manual Volume 1, Week 1: the modern hair restoration clinic as a coordinated system; the consultant and nurse as clinical-support professionals who inform, structure, document, and escalate within a doctor-led pathway. Emphasises patient safety, trust, accurate handover, and why excellence is integration—not conversion pressure.",
    "learningOutcomes": [
      "Explain how first-contact roles influence safety, trust, and efficiency before the doctor encounter",
      "Map the patient journey and identify failure points where communication or process breaks down",
      "Differentiate support tasks from diagnosis, suitability decisions, and informed consent",
      "Relate role clarity to sustainable reputation and lower medico-legal risk for the organisation"
    ],
    "competencyIds": ["consultants_competency_01_role_scope_foundations"],
    "unlockRules": [],
    "assessmentRules": [
      {
        "id": "assessment_rule_module_01",
        "description": "Module completion requires the linked assessment pass.",
        "requiredAssessmentIds": ["consultants_assessment_01_role_modern_hair_restoration"],
        "mandatoryDomainTags": ["ethics-scope"]
      }
    ],
    "facultyNoteIds": ["consultants_note_scope_language", "consultants_note_volume1_week1_faculty"],
    "complianceNoticeIds": [
      "notice_consultants_competency_scope",
      "notice_consultants_no_diagnostic_authority"
    ],
    "lessonIds": ["consultants_lesson_01_role_modern_hair_restoration"],
    "assessmentIds": ["consultants_assessment_01_role_modern_hair_restoration"],
    "caseStudyIds": ["consultants_case_01_role_modern_hair_restoration"],
    "practicalTaskIds": [],
    "referenceIds": ["consultants_reference_01"],
    "resourceIds": ["consultants_resource_01"]
  },
  {
    "id": "consultants_module_02_foundations_hair_scalp_science",
    "programId": "program_certificate_consultation_patient_coordination",
    "levelId": "level_consultants_foundation_certificate",
    "sectionId": "section_consultants_level_1_foundation",
    "slug": "foundations-of-hair-and-scalp-science",
    "title": "Foundations of Hair and Scalp Science",
    "shortTitle": "Hair and Scalp Science",
    "sequence": 2,
    "status": "draft",
    "estimatedStudyMinutes": 115,
    "moduleOverview": "Teaching Manual Volume 1, Week 3: hair follicle and cycle foundations, density versus calibre, and pattern vocabulary for plain-language education and neutral documentation. Positions science literacy as supporting trust and handover—not as a substitute for medical interpretation. Ethics and scope themes from Volume 1 Week 2 are taught in the Level 2 Ethics and Scope module.",
    "learningOutcomes": [
      "Describe follicle structure and the hair growth cycle in accessible patient language",
      "Explain density and calibre differences and why thinning can coexist with visible shedding",
      "Use educational pattern categories only as handover context, never as independent diagnosis",
      "Produce doctor-ready notes that separate observation from clinical interpretation"
    ],
    "competencyIds": ["consultants_competency_02_hair_scalp_literacy"],
    "unlockRules": [
      {
        "id": "unlock_module_02",
        "description": "Complete module 1 first.",
        "dependsOnType": "module",
        "dependsOnId": "consultants_module_01_role_modern_hair_restoration"
      }
    ],
    "assessmentRules": [
      {
        "id": "assessment_rule_module_02",
        "description": "Complete the linked knowledge check.",
        "requiredAssessmentIds": ["consultants_assessment_02_foundations_hair_scalp_science"],
        "mandatoryDomainTags": ["knowledge"]
      }
    ],
    "facultyNoteIds": ["consultants_note_volume1_week3_faculty"],
    "complianceNoticeIds": ["notice_consultants_competency_scope"],
    "lessonIds": ["consultants_lesson_02_foundations_hair_scalp_science"],
    "assessmentIds": ["consultants_assessment_02_foundations_hair_scalp_science"],
    "caseStudyIds": ["consultants_case_02_foundations_hair_scalp_science"],
    "practicalTaskIds": [],
    "referenceIds": ["consultants_reference_02"],
    "resourceIds": []
  },
  {
    "id": "consultants_module_03_common_hair_loss_presentations",
    "programId": "program_certificate_consultation_patient_coordination",
    "levelId": "level_consultants_foundation_certificate",
    "sectionId": "section_consultants_level_1_foundation",
    "slug": "common-hair-loss-presentations-seen-in-clinic",
    "title": "Common Hair Loss Presentations Seen in Clinic",
    "shortTitle": "Common Presentations",
    "sequence": 3,
    "status": "draft",
    "estimatedStudyMinutes": 115,
    "moduleOverview": "Teaching Manual Volume 1, Week 4: common hair loss presentations, red flags, psychosocial impact, and disciplined uncertainty. Trains descriptive pattern literacy and escalation judgment while keeping all clinical conclusions with the doctor. Cross-links to Ethics and Scope (Volume 1 Week 2) for boundary language under pressure.",
    "learningOutcomes": [
      "Describe common presentations using neutral, professional language suitable for handover",
      "Identify red-flag contexts that require escalation rather than reassurance",
      "Differentiate routine clinician review from higher-urgency pathways per protocol",
      "Support patients emotionally without offering diagnostic or treatment certainty"
    ],
    "competencyIds": ["consultants_competency_03_presentation_literacy"],
    "unlockRules": [
      {
        "id": "unlock_module_03",
        "description": "Complete module 2 first.",
        "dependsOnType": "module",
        "dependsOnId": "consultants_module_02_foundations_hair_scalp_science"
      }
    ],
    "assessmentRules": [
      {
        "id": "assessment_rule_module_03",
        "description": "Pass the linked image and scenario assessment.",
        "requiredAssessmentIds": ["consultants_assessment_03_common_hair_loss_presentations"],
        "mandatoryDomainTags": ["red-flags"]
      }
    ],
    "facultyNoteIds": ["consultants_note_volume1_week4_faculty"],
    "complianceNoticeIds": [
      "notice_consultants_no_diagnostic_authority",
      "notice_consultants_escalation_duty"
    ],
    "lessonIds": ["consultants_lesson_03_common_hair_loss_presentations"],
    "assessmentIds": ["consultants_assessment_03_common_hair_loss_presentations"],
    "caseStudyIds": ["consultants_case_03_common_hair_loss_presentations"],
    "practicalTaskIds": [],
    "referenceIds": ["consultants_reference_03"],
    "resourceIds": ["consultants_resource_08"]
  },
  {
    "id": "consultants_module_04_consultation_structure_information_gathering",
    "programId": "program_certificate_consultation_patient_coordination",
    "levelId": "level_consultants_foundation_certificate",
    "sectionId": "section_consultants_level_1_foundation",
    "slug": "consultation-structure-and-clinical-information-gathering",
    "title": "Consultation Structure and Clinical Information Gathering",
    "shortTitle": "Consultation Structure",
    "sequence": 4,
    "status": "draft",
    "estimatedStudyMinutes": 135,
    "moduleOverview": "Teaching Manual Volume 2, Week 5: consultation structure and history taking as applied practice—beginning, middle, and end; professional opening; clinically useful history; listening for goals, fears, and assumptions; and notes that support doctor handover and quality review. Safety and trust improve when structure precedes solution-selling.",
    "learningOutcomes": [
      "Run a bounded, repeatable consultation arc that orients the patient and protects role clarity",
      "Capture history that reflects onset, progression, context, and caution points without leading",
      "Record underlying concerns that affect expectations and clinician preparation",
      "Produce factual, handover-ready documentation rather than promotional summaries"
    ],
    "competencyIds": ["consultants_competency_04_structured_information_gathering"],
    "unlockRules": [
      {
        "id": "unlock_module_04",
        "description": "Complete module 3 first.",
        "dependsOnType": "module",
        "dependsOnId": "consultants_module_03_common_hair_loss_presentations"
      }
    ],
    "assessmentRules": [
      {
        "id": "assessment_rule_module_04",
        "description": "Pass the assessment and submit the linked practical task.",
        "requiredAssessmentIds": ["consultants_assessment_04_consultation_structure_information_gathering"],
        "mandatoryDomainTags": ["documentation", "communication"]
      }
    ],
    "facultyNoteIds": ["consultants_note_volume2_week5_faculty"],
    "complianceNoticeIds": [
      "notice_consultants_competency_scope",
      "notice_consultants_no_diagnostic_authority"
    ],
    "lessonIds": ["consultants_lesson_04_consultation_structure_information_gathering"],
    "assessmentIds": ["consultants_assessment_04_consultation_structure_information_gathering"],
    "caseStudyIds": ["consultants_case_04_consultation_structure_information_gathering"],
    "practicalTaskIds": ["consultants_task_04_consultation_structure_information_gathering"],
    "referenceIds": ["consultants_reference_04"],
    "resourceIds": ["consultants_resource_02"]
  },
  {
    "id": "consultants_module_05_candidate_screening_suitability_support",